{"schema":"morphloom.elements/0.1","seed":42,"units":"mm","coordinates":"right-handed-y-up","parts":[{"id":"animal_body","name":"animal_body","position":[0,65,0],"rotation":[0,0,0],"scale":[55,55,95],"shape":"ellipsoid","color":"#805b40","evidence":{"status":"authored","source":"Original Morphloom demo geometry; illustrative, not anatomy validation."},"visible":true,"locked":false}],"regions":[{"id":"body_fur_region","partId":"animal_body","name":"body_fur"}],"groups":[{"id":"body_fur","regionId":"body_fur_region","kind":"strand","count":50,"distribution":"ellipsoid-surface","root":[0,0,0],"spread":[0,0,0],"rotation":[0.3,0,0],"fan":0.08,"params":{"length":16,"width":1,"thickness":0.5,"curvature":0.12,"twist":0,"color":"#805b40","roughness":0.8},"overrides":{"body_fur/000000":{"params":{"length":24,"width":1,"thickness":0.5,"curvature":0.35,"twist":0,"color":"#805b40","roughness":0.8},"visible":true,"locked":false}},"deleted":[],"evidence":{"status":"authored","source":"Original Morphloom demo geometry; illustrative, not anatomy validation."}}],"elements":[]}